{
  "$schema": "https://json-schema.org/draft/2020-12/schema",
  "$id": "codebuddy-protocol.schema.json",
  "title": "CodeBuddy Code stream-json wire vocabulary",
  "description": "Each table maps PascalCase identifiers to protocol values. Go constants and TypeScript keys derive from those identifiers. Every table requires at least one value. An empty table supplies no dispatch case and prevents the generator from checking coverage.",
  "type": "object",
  "additionalProperties": false,
  "required": [
    "_readme",
    "frameKinds",
    "controlRequestSubtypes",
    "modes",
    "effortLevels",
    "systemSubtypes",
    "controlAnswer",
    "resultSupplement",
    "structs"
  ],
  "$defs": {
    "table": {
      "type": "object",
      "minProperties": 1,
      "propertyNames": {
        "pattern": "^[A-Z][A-Za-z0-9]*$"
      },
      "additionalProperties": {
        "type": "string",
        "minLength": 1
      }
    },
    "structs": {
      "description": "Generated Go structs use table values for their JSON tags. Each struct defines its field list once.",
      "type": "object",
      "minProperties": 1,
      "propertyNames": {
        "pattern": "^[A-Z][A-Za-z0-9]*$"
      },
      "additionalProperties": {
        "type": "object",
        "additionalProperties": false,
        "required": [
          "table",
          "fields"
        ],
        "properties": {
          "doc": {
            "type": "string",
            "minLength": 1
          },
          "table": {
            "type": "string",
            "minLength": 1
          },
          "fields": {
            "type": "array",
            "minItems": 1,
            "items": {
              "type": "object",
              "additionalProperties": false,
              "required": [
                "key",
                "type"
              ],
              "properties": {
                "key": {
                  "type": "string",
                  "pattern": "^[A-Z][A-Za-z0-9]*$"
                },
                "type": {
                  "type": "string",
                  "minLength": 1
                },
                "omitempty": {
                  "type": "boolean"
                },
                "table": {
                  "type": "string",
                  "minLength": 1
                }
              }
            }
          }
        }
      }
    }
  },
  "properties": {
    "_readme": {
      "type": "string",
      "minLength": 1
    },
    "_unread": {
      "type": "object",
      "minProperties": 1,
      "additionalProperties": {
        "type": "object",
        "minProperties": 1,
        "propertyNames": {
          "pattern": "^[A-Z][A-Za-z0-9]*$"
        },
        "additionalProperties": {
          "type": "object",
          "additionalProperties": false,
          "required": [
            "sides",
            "why"
          ],
          "properties": {
            "sides": {
              "type": "array",
              "minItems": 1,
              "uniqueItems": true,
              "items": {
                "enum": [
                  "go",
                  "ts"
                ]
              }
            },
            "why": {
              "type": "string",
              "minLength": 31
            }
          }
        }
      }
    },
    "frameKinds": {
      "$ref": "#/$defs/table"
    },
    "controlRequestSubtypes": {
      "$ref": "#/$defs/table"
    },
    "modes": {
      "$ref": "#/$defs/table"
    },
    "defaultMode": {
      "type": "string",
      "minLength": 1
    },
    "effortLevels": {
      "$ref": "#/$defs/table"
    },
    "systemSubtypes": {
      "$ref": "#/$defs/table"
    },
    "controlAnswer": {
      "$ref": "#/$defs/table"
    },
    "resultSupplement": {
      "$ref": "#/$defs/table"
    },
    "structs": {
      "$ref": "#/$defs/structs"
    }
  }
}
